{
  "$comment": "SPDX-License-Identifier: Apache-2.0. Copyright 2026 OKPF Contributors.",
  "$schema": "https://json-schema.org/draft/2020-12/schema",
  "$id": "https://okpf.org/schemas/0.1.0/provenance.schema.json",
  "title": "OKPF Provenance",
  "description": "Provenance record tracking the origin and transformation history of pack content.",
  "type": "object",
  "required": [
    "sources"
  ],
  "additionalProperties": true,
  "properties": {
    "created_by": {
      "type": "string",
      "description": "Contributor ID of the person or system that assembled this pack."
    },
    "created_at": {
      "type": "string",
      "description": "ISO 8601 timestamp of pack assembly.",
      "format": "date-time"
    },
    "notes": {
      "type": "string",
      "description": "Human-readable notes about the provenance of this pack."
    },
    "sources": {
      "type": "array",
      "description": "Original sources from which content was derived.",
      "items": {
        "type": "object",
        "required": [
          "id",
          "type"
        ],
        "additionalProperties": true,
        "properties": {
          "id": {
            "type": "string",
            "description": "Unique identifier for this source within the provenance record."
          },
          "type": {
            "type": "string",
            "description": "Nature of the original source.",
            "enum": [
              "original",
              "derived",
              "interview",
              "publication",
              "dataset",
              "recording",
              "observation",
              "other"
            ]
          },
          "title": {
            "type": "string",
            "description": "Title or name of the source."
          },
          "uri": {
            "type": "string",
            "description": "URI or URL identifying the source (may be a DOI, URL, or internal reference)."
          },
          "accessed": {
            "type": "string",
            "description": "ISO 8601 date the source was accessed or captured.",
            "format": "date"
          },
          "sha256": {
            "type": "string",
            "description": "SHA-256 hex digest of the source content at time of capture.",
            "pattern": "^[a-f0-9]{64}$"
          },
          "license": {
            "type": "string",
            "description": "SPDX license expression for the source."
          },
          "description": {
            "type": "string",
            "description": "Description of the source and what it contributes to this pack."
          },
          "author": {
            "type": "string",
            "description": "Author or creator of the source."
          },
          "published": {
            "type": "string",
            "description": "Publication or creation date of the source.",
            "format": "date"
          }
        }
      }
    },
    "transformations": {
      "type": "array",
      "description": "Ordered log of transformations applied to source content to produce pack artifacts.",
      "items": {
        "type": "object",
        "required": [
          "id",
          "type"
        ],
        "additionalProperties": true,
        "properties": {
          "id": {
            "type": "string",
            "description": "Unique identifier for this transformation."
          },
          "type": {
            "type": "string",
            "description": "Category of transformation.",
            "enum": [
              "manual",
              "automated",
              "review",
              "translation",
              "summarization",
              "extraction",
              "annotation",
              "curation",
              "combination",
              "other"
            ]
          },
          "input_sources": {
            "type": "array",
            "description": "IDs of source records used as input to this transformation.",
            "items": {
              "type": "string"
            }
          },
          "output_artifacts": {
            "type": "array",
            "description": "IDs of content artifacts produced by this transformation.",
            "items": {
              "type": "string"
            }
          },
          "performed_by": {
            "type": "string",
            "description": "Contributor ID of the person or system that performed this transformation."
          },
          "performed_at": {
            "type": "string",
            "description": "ISO 8601 timestamp of the transformation.",
            "format": "date-time"
          },
          "description": {
            "type": "string",
            "description": "Human-readable description of what was done."
          },
          "tool": {
            "type": "string",
            "description": "Tool or system used for automated transformations."
          },
          "tool_version": {
            "type": "string",
            "description": "Version of the tool."
          },
          "reviewed_by": {
            "type": "string",
            "description": "Contributor ID who reviewed this transformation for accuracy."
          }
        }
      }
    }
  }
}